{
  "run_id": "contract_run_req_provider_001",
  "step_id": "send_owner_report",
  "event_type": "contract_run.operation_admitted",
  "timestamp": "2026-05-23T08:32:30Z",
  "subject": {
    "operation_id": "op_send_owner_report"
  },
  "result": {
    "operation_id": "op_send_owner_report",
    "decision": "allow",
    "reason_code": "NEXT_OPERATION_ALLOWED",
    "allowed_connector_id": "provider.connector.v1",
    "allowed_endpoint_ref": null,
    "allowed_method": "POST"
  },
  "metadata": {},
  "evidence_ref": "ev_contract_run_req_provider_001_002"
}
