{
  "run_id": "contract_run_req_provider_001",
  "step_id": "send_owner_report",
  "event_type": "contract_run.step_executed",
  "timestamp": "2026-05-23T08:33:00Z",
  "subject": {
    "operation_id": "op_send_owner_report"
  },
  "result": {
    "status": "step_completed",
    "admission": {
      "decision": "allow",
      "reason_code": "OPERATION_ALLOWED",
      "allowed_connector_id": "provider.connector.v1",
      "allowed_endpoint_ref": null,
      "allowed_method": "POST"
    },
    "connector_summary": {
      "connector_id": "provider.connector.v1",
      "endpoint_ref": null,
      "connector_ref": "telegram.owner_report_channel",
      "operation": "send_message",
      "method": "POST",
      "side_effect_intent": "external_network",
      "connector_status": "completed",
      "provider": "telegram",
      "connector_mode": "deterministic_fake_provider_connector",
      "response_preview": {
        "ok": true,
        "message_id": 1001
      },
      "attempts": 1,
      "timeout_ms": 10000
    }
  },
  "metadata": {},
  "evidence_ref": "ev_contract_run_req_provider_001_003"
}
